Best trial: 24. Best value: 0.827204:  67%|######7   | 67/100 [00:16<00:07,  4.26it/s]Best trial: 24. Best value: 0.827204:  67%|######7   | 67/100 [00:16<00:07,  4.26it/s]Best trial: 24. Best value: 0.827204:  68%|######8   | 68/100 [00:16<00:07,  4.24it/s]                                                                                      [32m[I 2026-07-13 13:25:24,823][0m Trial 68 finished with value: 0.8060967201812271 and parameters: {'criterion': 'log_loss', 'max_depth': 10, 'min_samples_split': 7, 'min_samples_leaf': 3, 'max_leaf_nodes': None, 'ccp_alpha': 0.003}. Best is trial 24 with value: 0.8272037821333595.[0m
Best trial: 24. Best value: 0.827204:  68%|######8   | 68/100 [00:16<00:07,  4.24it/s]Best trial: 24. Best value: 0.827204:  68%|######8   | 68/100 [00:16<00:07,  4.24it/s]Best trial: 24. Best value: 0.827204:  69%|######9   | 69/100 [00:16<00:07,  4.23it/s]                                                                                      [32m[I 2026-07-13 13:25:25,058][0m Trial 69 finished with value: 0.8075347188023244 and parameters: {'criterion': 'gini', 'max_depth': 11, 'min_samples_split': 9, 'min_samples_leaf': 3, 'max_leaf_nodes': 22, 'ccp_alpha': 0.005}. Best is trial 24 with value: 0.8272037821333595.[0m
Best trial: 24. Best value: 0.827204:  69%|######9   | 69/100 [00:16<00:07,  4.23it/s]Best trial: 24. Best value: 0.827204:  69%|######9   | 69/100 [00:16<00:07,  4.23it/s]Best trial: 24. Best value: 0.827204:  70%|#######   | 70/100 [00:16<00:07,  4.21it/s]                                                                                      [32m[I 2026-07-13 13:25:25,291][0m Trial 70 finished with value: 0.8089924160346695 and parameters: {'criterion': 'log_loss', 'max_depth': 9, 'min_samples_split': 13, 'min_samples_leaf': 6, 'max_leaf_nodes': 25, 'ccp_alpha': 0.001}. Best is trial 24 with value: 0.8272037821333595.[0m
Best trial: 24. Best value: 0.827204:  70%|#######   | 70/100 [00:17<00:07,  4.21it/s]Best trial: 24. Best value: 0.827204:  70%|#######   | 70/100 [00:17<00:07,  4.21it/s]Best trial: 24. Best value: 0.827204:  71%|#######1  | 71/100 [00:17<00:06,  4.24it/s]                                                                                      [32m[I 2026-07-13 13:25:25,527][0m Trial 71 finished with value: 0.8272037821333595 and parameters: {'criterion': 'log_loss', 'max_depth': 8, 'min_samples_split': 9, 'min_samples_leaf': 4, 'max_leaf_nodes': 18, 'ccp_alpha': 0.003}. Best is trial 24 with value: 0.8272037821333595.[0m
Best trial: 24. Best value: 0.827204:  71%|#######1  | 71/100 [00:17<00:06,  4.24it/s]Best trial: 24. Best value: 0.827204:  71%|#######1  | 71/100 [00:17<00:06,  4.24it/s]Best trial: 24. Best value: 0.827204:  72%|#######2  | 72/100 [00:17<00:06,  4.24it/s]                                                                                      [32m[I 2026-07-13 13:25:25,760][0m Trial 72 finished with value: 0.8243770314192849 and parameters: {'criterion': 'log_loss', 'max_depth': 7, 'min_samples_split': 6, 'min_samples_leaf': 4, 'max_leaf_nodes': 18, 'ccp_alpha': 0.003}. Best is trial 24 with value: 0.8272037821333595.[0m
Best trial: 24. Best value: 0.827204:  72%|#######2  | 72/100 [00:17<00:06,  4.24it/s]Best trial: 24. Best value: 0.827204:  72%|#######2  | 72/100 [00:17<00:06,  4.24it/s]Best trial: 24. Best value: 0.827204:  73%|#######3  | 73/100 [00:17<00:06,  4.25it/s]                                                                                      [32m[I 2026-07-13 13:25:26,001][0m Trial 73 finished with value: 0.817374175120654 and parameters: {'criterion': 'log_loss', 'max_depth': 8, 'min_samples_split': 10, 'min_samples_leaf': 5, 'max_leaf_nodes': 18, 'ccp_alpha': 0.003}. Best is trial 24 with value: 0.8272037821333595.[0m
Best trial: 24. Best value: 0.827204:  73%|#######3  | 73/100 [00:17<00:06,  4.25it/s]Best trial: 24. Best value: 0.827204:  73%|#######3  | 73/100 [00:17<00:06,  4.25it/s]Best trial: 24. Best value: 0.827204:  74%|#######4  | 74/100 [00:17<00:06,  4.24it/s]                                                                                      [32m[I 2026-07-13 13:25:26,231][0m Trial 74 finished with value: 0.8117896188318724 and parameters: {'criterion': 'log_loss', 'max_depth': 7, 'min_samples_split': 30, 'min_samples_leaf': 4, 'max_leaf_nodes': 18, 'ccp_alpha': 0.003}. Best is trial 24 with value: 0.8272037821333595.[0m
Best trial: 24. Best value: 0.827204:  74%|#######4  | 74/100 [00:17<00:06,  4.24it/s]Best trial: 24. Best value: 0.827204:  74%|#######4  | 74/100 [00:18<00:06,  4.24it/s]Best trial: 24. Best value: 0.827204:  75%|#######5  | 75/100 [00:18<00:05,  4.28it/s]                                                                                      [32m[I 2026-07-13 13:25:26,467][0m Trial 75 finished with value: 0.8033389146065202 and parameters: {'criterion': 'log_loss', 'max_depth': 10, 'min_samples_split': 7, 'min_samples_leaf': 5, 'max_leaf_nodes': 35, 'ccp_alpha': 0.002}. Best is trial 24 with value: 0.8272037821333595.[0m
Best trial: 24. Best value: 0.827204:  75%|#######5  | 75/100 [00:18<00:05,  4.28it/s]Best trial: 24. Best value: 0.827204:  75%|#######5  | 75/100 [00:18<00:05,  4.28it/s]Best trial: 24. Best value: 0.827204:  76%|#######6  | 76/100 [00:18<00:05,  4.26it/s]                                                                                      [32m[I 2026-07-13 13:25:26,705][0m Trial 76 finished with value: 0.8117797695262483 and parameters: {'criterion': 'log_loss', 'max_depth': 12, 'min_samples_split': 12, 'min_samples_leaf': 3, 'max_leaf_nodes': 30, 'ccp_alpha': 0.0015}. Best is trial 24 with value: 0.8272037821333595.[0m
Best trial: 24. Best value: 0.827204:  76%|#######6  | 76/100 [00:18<00:05,  4.26it/s]Best trial: 24. Best value: 0.827204:  76%|#######6  | 76/100 [00:18<00:05,  4.26it/s]Best trial: 24. Best value: 0.827204:  77%|#######7  | 77/100 [00:18<00:05,  4.24it/s]                                                                                      [32m[I 2026-07-13 13:25:26,941][0m Trial 77 finished with value: 0.8188023244361272 and parameters: {'criterion': 'log_loss', 'max_depth': 9, 'min_samples_split': 8, 'min_samples_leaf': 4, 'max_leaf_nodes': 10, 'ccp_alpha': 0.003}. Best is trial 24 with value: 0.8272037821333595.[0m
Best trial: 24. Best value: 0.827204:  77%|#######7  | 77/100 [00:18<00:05,  4.24it/s]Best trial: 24. Best value: 0.827204:  77%|#######7  | 77/100 [00:18<00:05,  4.24it/s]Best trial: 24. Best value: 0.827204:  78%|#######8  | 78/100 [00:18<00:05,  4.25it/s]                                                                                      [32m[I 2026-07-13 13:25:27,176][0m Trial 78 finished with value: 0.8229882793263075 and parameters: {'criterion': 'log_loss', 'max_depth': 8, 'min_samples_split': 3, 'min_samples_leaf': 2, 'max_leaf_nodes': 18, 'ccp_alpha': 0.004}. Best is trial 24 with value: 0.8272037821333595.[0m
Best trial: 24. Best value: 0.827204:  78%|#######8  | 78/100 [00:18<00:05,  4.25it/s]Best trial: 24. Best value: 0.827204:  78%|#######8  | 78/100 [00:18<00:05,  4.25it/s]Best trial: 24. Best value: 0.827204:  79%|#######9  | 79/100 [00:18<00:04,  4.22it/s]                                                                                      [32m[I 2026-07-13 13:25:27,420][0m Trial 79 finished with value: 0.8202009258347287 and parameters: {'criterion': 'entropy', 'max_depth': 11, 'min_samples_split': 10, 'min_samples_leaf': 6, 'max_leaf_nodes': 15, 'ccp_alpha': 0.0005}. Best is trial 24 with value: 0.8272037821333595.[0m
Best trial: 24. Best value: 0.827204:  79%|#######9  | 79/100 [00:19<00:04,  4.22it/s]Best trial: 24. Best value: 0.827204:  79%|#######9  | 79/100 [00:19<00:04,  4.22it/s]Best trial: 24. Best value: 0.827204:  80%|########  | 80/100 [00:19<00:04,  4.08it/s]                                                                                      [32m[I 2026-07-13 13:25:27,691][0m Trial 80 finished with value: 0.806136117403723 and parameters: {'criterion': 'log_loss', 'max_depth': 12, 'min_samples_split': 5, 'min_samples_leaf': 5, 'max_leaf_nodes': 40, 'ccp_alpha': 0.003}. Best is trial 24 with value: 0.8272037821333595.[0m
Best trial: 24. Best value: 0.827204:  80%|########  | 80/100 [00:19<00:04,  4.08it/s]Best trial: 24. Best value: 0.827204:  80%|########  | 80/100 [00:19<00:04,  4.08it/s]Best trial: 24. Best value: 0.827204:  81%|########1 | 81/100 [00:19<00:04,  4.03it/s]                                                                                      [32m[I 2026-07-13 13:25:27,947][0m Trial 81 finished with value: 0.8272037821333595 and parameters: {'criterion': 'log_loss', 'max_depth': 9, 'min_samples_split': 4, 'min_samples_leaf': 4, 'max_leaf_nodes': 18, 'ccp_alpha': 0.003}. Best is trial 24 with value: 0.8272037821333595.[0m
Best trial: 24. Best value: 0.827204:  81%|########1 | 81/100 [00:19<00:04,  4.03it/s]Best trial: 24. Best value: 0.827204:  81%|########1 | 81/100 [00:19<00:04,  4.03it/s]Best trial: 24. Best value: 0.827204:  82%|########2 | 82/100 [00:19<00:04,  4.01it/s]                                                                                      [32m[I 2026-07-13 13:25:28,192][0m Trial 82 finished with value: 0.8257854821235103 and parameters: {'criterion': 'log_loss', 'max_depth': 9, 'min_samples_split': 4, 'min_samples_leaf': 3, 'max_leaf_nodes': 18, 'ccp_alpha': 0.003}. Best is trial 24 with value: 0.8272037821333595.[0m
Best trial: 24. Best value: 0.827204:  82%|########2 | 82/100 [00:19<00:04,  4.01it/s]Best trial: 24. Best value: 0.827204:  82%|########2 | 82/100 [00:20<00:04,  4.01it/s]Best trial: 24. Best value: 0.827204:  83%|########2 | 83/100 [00:20<00:04,  4.03it/s]                                                                                      [32m[I 2026-07-13 13:25:28,416][0m Trial 83 finished with value: 0.8272037821333595 and parameters: {'criterion': 'log_loss', 'max_depth': 8, 'min_samples_split': 9, 'min_samples_leaf': 4, 'max_leaf_nodes': 18, 'ccp_alpha': 0.003}. Best is trial 24 with value: 0.8272037821333595.[0m
Best trial: 24. Best value: 0.827204:  83%|########2 | 83/100 [00:20<00:04,  4.03it/s]Best trial: 24. Best value: 0.827204:  83%|########2 | 83/100 [00:20<00:04,  4.03it/s]Best trial: 24. Best value: 0.827204:  84%|########4 | 84/100 [00:20<00:03,  4.11it/s]                                                                                      [32m[I 2026-07-13 13:25:28,665][0m Trial 84 finished with value: 0.8272037821333595 and parameters: {'criterion': 'log_loss', 'max_depth': 10, 'min_samples_split': 6, 'min_samples_leaf': 4, 'max_leaf_nodes': 18, 'ccp_alpha': 0.003}. Best is trial 24 with value: 0.8272037821333595.[0m
Best trial: 24. Best value: 0.827204:  84%|########4 | 84/100 [00:20<00:03,  4.11it/s]Best trial: 24. Best value: 0.827204:  84%|########4 | 84/100 [00:20<00:03,  4.11it/s]Best trial: 24. Best value: 0.827204:  85%|########5 | 85/100 [00:20<00:03,  4.15it/s]                                                                                      [32m[I 2026-07-13 13:25:28,898][0m Trial 85 finished with value: 0.817374175120654 and parameters: {'criterion': 'log_loss', 'max_depth': 8, 'min_samples_split': 8, 'min_samples_leaf': 5, 'max_leaf_nodes': 18, 'ccp_alpha': 0.002}. Best is trial 24 with value: 0.8272037821333595.[0m
Best trial: 24. Best value: 0.827204:  85%|########5 | 85/100 [00:20<00:03,  4.15it/s]Best trial: 24. Best value: 0.827204:  85%|########5 | 85/100 [00:20<00:03,  4.15it/s]Best trial: 24. Best value: 0.827204:  86%|########6 | 86/100 [00:20<00:03,  4.18it/s]                                                                                      [32m[I 2026-07-13 13:25:29,136][0m Trial 86 finished with value: 0.8103417709051512 and parameters: {'criterion': 'gini', 'max_depth': 10, 'min_samples_split': 11, 'min_samples_leaf': 3, 'max_leaf_nodes': 18, 'ccp_alpha': 0.01}. Best is trial 24 with value: 0.8272037821333595.[0m
Best trial: 24. Best value: 0.827204:  86%|########6 | 86/100 [00:20<00:03,  4.18it/s]Best trial: 24. Best value: 0.827204:  86%|########6 | 86/100 [00:20<00:03,  4.18it/s]Best trial: 24. Best value: 0.827204:  87%|########7 | 87/100 [00:20<00:03,  4.18it/s]                                                                                      [32m[I 2026-07-13 13:25:29,371][0m Trial 87 finished with value: 0.7836600019698612 and parameters: {'criterion': 'log_loss', 'max_depth': 7, 'min_samples_split': 5, 'min_samples_leaf': 10, 'max_leaf_nodes': 20, 'ccp_alpha': 0.003}. Best is trial 24 with value: 0.8272037821333595.[0m
Best trial: 24. Best value: 0.827204:  87%|########7 | 87/100 [00:21<00:03,  4.18it/s]Best trial: 24. Best value: 0.827204:  87%|########7 | 87/100 [00:21<00:03,  4.18it/s]Best trial: 24. Best value: 0.827204:  88%|########8 | 88/100 [00:21<00:02,  4.18it/s]                                                                                      [32m[I 2026-07-13 13:25:29,613][0m Trial 88 finished with value: 0.8272037821333595 and parameters: {'criterion': 'log_loss', 'max_depth': 9, 'min_samples_split': 3, 'min_samples_leaf': 4, 'max_leaf_nodes': 18, 'ccp_alpha': 0.003}. Best is trial 24 with value: 0.8272037821333595.[0m
Best trial: 24. Best value: 0.827204:  88%|########8 | 88/100 [00:21<00:02,  4.18it/s]Best trial: 24. Best value: 0.827204:  88%|########8 | 88/100 [00:21<00:02,  4.18it/s]Best trial: 24. Best value: 0.827204:  89%|########9 | 89/100 [00:21<00:02,  4.21it/s]                                                                                      [32m[I 2026-07-13 13:25:29,844][0m Trial 89 finished with value: 0.8229882793263075 and parameters: {'criterion': 'log_loss', 'max_depth': 11, 'min_samples_split': 9, 'min_samples_leaf': 2, 'max_leaf_nodes': 18, 'ccp_alpha': 0.0}. Best is trial 24 with value: 0.8272037821333595.[0m
Best trial: 24. Best value: 0.827204:  89%|########9 | 89/100 [00:21<00:02,  4.21it/s]Best trial: 24. Best value: 0.827204:  89%|########9 | 89/100 [00:21<00:02,  4.21it/s]Best trial: 24. Best value: 0.827204:  90%|######### | 90/100 [00:21<00:02,  4.20it/s]                                                                                      [32m[I 2026-07-13 13:25:30,088][0m Trial 90 finished with value: 0.8103910174332711 and parameters: {'criterion': 'log_loss', 'max_depth': 9, 'min_samples_split': 6, 'min_samples_leaf': 6, 'max_leaf_nodes': 18, 'ccp_alpha': 0.003}. Best is trial 24 with value: 0.8272037821333595.[0m
Best trial: 24. Best value: 0.827204:  90%|######### | 90/100 [00:21<00:02,  4.20it/s]Best trial: 24. Best value: 0.827204:  90%|######### | 90/100 [00:21<00:02,  4.20it/s]Best trial: 24. Best value: 0.827204:  91%|#########1| 91/100 [00:21<00:02,  4.18it/s]                                                                                      [32m[I 2026-07-13 13:25:30,337][0m Trial 91 finished with value: 0.8272037821333595 and parameters: {'criterion': 'log_loss', 'max_depth': 11, 'min_samples_split': 7, 'min_samples_leaf': 4, 'max_leaf_nodes': 18, 'ccp_alpha': 0.005}. Best is trial 24 with value: 0.8272037821333595.[0m
Best trial: 24. Best value: 0.827204:  91%|#########1| 91/100 [00:22<00:02,  4.18it/s]Best trial: 24. Best value: 0.827204:  91%|#########1| 91/100 [00:22<00:02,  4.18it/s]Best trial: 24. Best value: 0.827204:  92%|#########2| 92/100 [00:22<00:01,  4.14it/s]                                                                                      [32m[I 2026-07-13 13:25:30,586][0m Trial 92 finished with value: 0.8272037821333595 and parameters: {'criterion': 'log_loss', 'max_depth': 11, 'min_samples_split': 8, 'min_samples_leaf': 4, 'max_leaf_nodes': 18, 'ccp_alpha': 0.0}. Best is trial 24 with value: 0.8272037821333595.[0m
Best trial: 24. Best value: 0.827204:  92%|#########2| 92/100 [00:22<00:01,  4.14it/s]Best trial: 24. Best value: 0.827204:  92%|#########2| 92/100 [00:22<00:01,  4.14it/s]Best trial: 24. Best value: 0.827204:  93%|#########3| 93/100 [00:22<00:01,  4.13it/s]                                                                                      [32m[I 2026-07-13 13:25:30,811][0m Trial 93 finished with value: 0.817374175120654 and parameters: {'criterion': 'log_loss', 'max_depth': 10, 'min_samples_split': 8, 'min_samples_leaf': 5, 'max_leaf_nodes': 18, 'ccp_alpha': 0.0}. Best is trial 24 with value: 0.8272037821333595.[0m
Best trial: 24. Best value: 0.827204:  93%|#########3| 93/100 [00:22<00:01,  4.13it/s]Best trial: 24. Best value: 0.827204:  93%|#########3| 93/100 [00:22<00:01,  4.13it/s]Best trial: 24. Best value: 0.827204:  94%|#########3| 94/100 [00:22<00:01,  4.21it/s]                                                                                      [32m[I 2026-07-13 13:25:31,045][0m Trial 94 finished with value: 0.8286023835319611 and parameters: {'criterion': 'log_loss', 'max_depth': 11, 'min_samples_split': 10, 'min_samples_leaf': 3, 'max_leaf_nodes': 18, 'ccp_alpha': 0.0}. Best is trial 94 with value: 0.8286023835319611.[0m
Best trial: 24. Best value: 0.827204:  94%|#########3| 94/100 [00:22<00:01,  4.21it/s]Best trial: 94. Best value: 0.828602:  94%|#########3| 94/100 [00:22<00:01,  4.21it/s]Best trial: 94. Best value: 0.828602:  95%|#########5| 95/100 [00:22<00:01,  4.20it/s]                                                                                      [32m[I 2026-07-13 13:25:31,288][0m Trial 95 finished with value: 0.8089727174234216 and parameters: {'criterion': 'log_loss', 'max_depth': 8, 'min_samples_split': 11, 'min_samples_leaf': 3, 'max_leaf_nodes': 25, 'ccp_alpha': 0.0}. Best is trial 94 with value: 0.8286023835319611.[0m
Best trial: 94. Best value: 0.828602:  95%|#########5| 95/100 [00:23<00:01,  4.20it/s]Best trial: 94. Best value: 0.828602:  95%|#########5| 95/100 [00:23<00:01,  4.20it/s]Best trial: 94. Best value: 0.828602:  96%|#########6| 96/100 [00:23<00:00,  4.19it/s]                                                                                      [32m[I 2026-07-13 13:25:31,531][0m Trial 96 finished with value: 0.7836501526642372 and parameters: {'criterion': 'log_loss', 'max_depth': 11, 'min_samples_split': 7, 'min_samples_leaf': 14, 'max_leaf_nodes': 18, 'ccp_alpha': 0.001}. Best is trial 94 with value: 0.8286023835319611.[0m
Best trial: 94. Best value: 0.828602:  96%|#########6| 96/100 [00:23<00:00,  4.19it/s]Best trial: 94. Best value: 0.828602:  96%|#########6| 96/100 [00:23<00:00,  4.19it/s]Best trial: 94. Best value: 0.828602:  97%|#########7| 97/100 [00:23<00:00,  4.15it/s]                                                                                      [32m[I 2026-07-13 13:25:31,768][0m Trial 97 finished with value: 0.8173840244262781 and parameters: {'criterion': 'log_loss', 'max_depth': 10, 'min_samples_split': 22, 'min_samples_leaf': 3, 'max_leaf_nodes': 10, 'ccp_alpha': 0.002}. Best is trial 94 with value: 0.8286023835319611.[0m
Best trial: 94. Best value: 0.828602:  97%|#########7| 97/100 [00:23<00:00,  4.15it/s]Best trial: 94. Best value: 0.828602:  97%|#########7| 97/100 [00:23<00:00,  4.15it/s]Best trial: 94. Best value: 0.828602:  98%|#########8| 98/100 [00:23<00:00,  4.19it/s]                                                                                      [32m[I 2026-07-13 13:25:32,012][0m Trial 98 finished with value: 0.7948980596867921 and parameters: {'criterion': 'entropy', 'max_depth': 12, 'min_samples_split': 10, 'min_samples_leaf': 5, 'max_leaf_nodes': None, 'ccp_alpha': 0.003}. Best is trial 94 with value: 0.8286023835319611.[0m
