Best trial: 94. Best value: 0.828602:  98%|#########8| 98/100 [00:23<00:00,  4.19it/s]Best trial: 94. Best value: 0.828602:  98%|#########8| 98/100 [00:23<00:00,  4.19it/s]Best trial: 94. Best value: 0.828602:  99%|#########9| 99/100 [00:23<00:00,  4.16it/s]                                                                                      [32m[I 2026-07-13 13:25:32,232][0m Trial 99 finished with value: 0.814586821629075 and parameters: {'criterion': 'log_loss', 'max_depth': 11, 'min_samples_split': 12, 'min_samples_leaf': 3, 'max_leaf_nodes': 22, 'ccp_alpha': 0.004}. Best is trial 94 with value: 0.8286023835319611.[0m
Best trial: 94. Best value: 0.828602:  99%|#########9| 99/100 [00:23<00:00,  4.16it/s]Best trial: 94. Best value: 0.828602:  99%|#########9| 99/100 [00:24<00:00,  4.16it/s]Best trial: 94. Best value: 0.828602: 100%|##########| 100/100 [00:24<00:00,  4.22it/s]Best trial: 94. Best value: 0.828602: 100%|##########| 100/100 [00:24<00:00,  4.16it/s]

======================================================================
Saving Optuna Results
======================================================================
Trials saved to: ./outputs/optuna/135_decision_tree_optuna_100_trials.csv
Best parameters saved to: ./outputs/optuna/135_decision_tree_optuna_100_trials_best_params.yaml

======================================================================
Optuna Results
======================================================================

Best trial:
Trial number: 94
CV Accuracy: 0.8286
CV STD: 0.0191
Fold scores:
Fold 0: 0.8392
Fold 1: 0.8531
Fold 2: 0.8239
Fold 3: 0.8310
Fold 4: 0.7958

Best parameters:
criterion: log_loss
max_depth: 11
min_samples_split: 10
min_samples_leaf: 3
max_leaf_nodes: 18
ccp_alpha: 0.0

Top 10 trials:
 trial_number  cv_score   cv_std params_criterion  params_max_depth  params_min_samples_split  params_min_samples_leaf  params_max_leaf_nodes  params_ccp_alpha
           94  0.828602 0.019073         log_loss                11                        10                        3                   18.0             0.000
           24  0.827204 0.020542         log_loss                10                         8                        4                   18.0             0.002
           32  0.827204 0.020542         log_loss                11                         4                        4                   18.0             0.003
           33  0.827204 0.020542         log_loss                11                         6                        4                   18.0             0.003
           35  0.827204 0.020542         log_loss                10                        10                        4                   18.0             0.003
           36  0.827204 0.020542         log_loss                 8                         9                        4                   18.0             0.003
           41  0.827204 0.020542         log_loss                 8                         9                        4                   18.0             0.003
           49  0.827204 0.020542         log_loss                11                         8                        4                   18.0             0.000
           51  0.827204 0.020542         log_loss                 8                         9                        4                   18.0             0.003
           60  0.827204 0.020542         log_loss                 9                         4                        4                   18.0             0.003
