
======================================================================
Experiment: 135_decision_tree_optuna_100_trials
======================================================================

======================================================================
Optuna Study
======================================================================
Study name: decision_tree_tuning
Direction: maximize
Number of trials: 100
CV folds: 5
Holdout evaluation: disabled during tuning
  0%|          | 0/100 [00:00<?, ?it/s]                                       [32m[I 2026-07-13 13:25:08,404][0m Trial 0 finished with value: 0.8075445681079485 and parameters: {'criterion': 'log_loss', 'max_depth': 3, 'min_samples_split': 9, 'min_samples_leaf': 15, 'max_leaf_nodes': 15, 'ccp_alpha': 0.0015}. Best is trial 0 with value: 0.8075445681079485.[0m
  0%|          | 0/100 [00:00<?, ?it/s]Best trial: 0. Best value: 0.807545:   0%|          | 0/100 [00:00<?, ?it/s]Best trial: 0. Best value: 0.807545:   1%|1         | 1/100 [00:00<00:22,  4.32it/s]                                                                                    [32m[I 2026-07-13 13:25:08,632][0m Trial 1 finished with value: 0.8188023244361272 and parameters: {'criterion': 'log_loss', 'max_depth': 6, 'min_samples_split': 20, 'min_samples_leaf': 4, 'max_leaf_nodes': 10, 'ccp_alpha': 0.003}. Best is trial 1 with value: 0.8188023244361272.[0m
Best trial: 0. Best value: 0.807545:   1%|1         | 1/100 [00:00<00:22,  4.32it/s]Best trial: 1. Best value: 0.818802:   1%|1         | 1/100 [00:00<00:22,  4.32it/s]Best trial: 1. Best value: 0.818802:   2%|2         | 2/100 [00:00<00:22,  4.38it/s]                                                                                    [32m[I 2026-07-13 13:25:08,863][0m Trial 2 finished with value: 0.7822220033487639 and parameters: {'criterion': 'gini', 'max_depth': 7, 'min_samples_split': 26, 'min_samples_leaf': 9, 'max_leaf_nodes': 15, 'ccp_alpha': 0.0005}. Best is trial 1 with value: 0.8188023244361272.[0m
Best trial: 1. Best value: 0.818802:   2%|2         | 2/100 [00:00<00:22,  4.38it/s]Best trial: 1. Best value: 0.818802:   2%|2         | 2/100 [00:00<00:22,  4.38it/s]Best trial: 1. Best value: 0.818802:   3%|3         | 3/100 [00:00<00:22,  4.32it/s]                                                                                    [32m[I 2026-07-13 13:25:09,091][0m Trial 3 finished with value: 0.8117699202206244 and parameters: {'criterion': 'log_loss', 'max_depth': 5, 'min_samples_split': 26, 'min_samples_leaf': 5, 'max_leaf_nodes': 10, 'ccp_alpha': 0.01}. Best is trial 1 with value: 0.8188023244361272.[0m
Best trial: 1. Best value: 0.818802:   3%|3         | 3/100 [00:00<00:22,  4.32it/s]Best trial: 1. Best value: 0.818802:   3%|3         | 3/100 [00:00<00:22,  4.32it/s]Best trial: 1. Best value: 0.818802:   4%|4         | 4/100 [00:00<00:22,  4.34it/s]                                                                                    [32m[I 2026-07-13 13:25:09,322][0m Trial 4 finished with value: 0.8004826159755737 and parameters: {'criterion': 'log_loss', 'max_depth': 9, 'min_samples_split': 19, 'min_samples_leaf': 15, 'max_leaf_nodes': 20, 'ccp_alpha': 0.01}. Best is trial 1 with value: 0.8188023244361272.[0m
Best trial: 1. Best value: 0.818802:   4%|4         | 4/100 [00:01<00:22,  4.34it/s]Best trial: 1. Best value: 0.818802:   4%|4         | 4/100 [00:01<00:22,  4.34it/s]Best trial: 1. Best value: 0.818802:   5%|5         | 5/100 [00:01<00:21,  4.38it/s]                                                                                    [32m[I 2026-07-13 13:25:09,545][0m Trial 5 finished with value: 0.7850093568403428 and parameters: {'criterion': 'gini', 'max_depth': 7, 'min_samples_split': 19, 'min_samples_leaf': 10, 'max_leaf_nodes': 15, 'ccp_alpha': 0.001}. Best is trial 1 with value: 0.8188023244361272.[0m
Best trial: 1. Best value: 0.818802:   5%|5         | 5/100 [00:01<00:21,  4.38it/s]Best trial: 1. Best value: 0.818802:   5%|5         | 5/100 [00:01<00:21,  4.38it/s]Best trial: 1. Best value: 0.818802:   6%|6         | 6/100 [00:01<00:21,  4.38it/s]                                                                                    [32m[I 2026-07-13 13:25:09,761][0m Trial 6 finished with value: 0.7948685117699202 and parameters: {'criterion': 'gini', 'max_depth': 3, 'min_samples_split': 7, 'min_samples_leaf': 2, 'max_leaf_nodes': 15, 'ccp_alpha': 0.002}. Best is trial 1 with value: 0.8188023244361272.[0m
Best trial: 1. Best value: 0.818802:   6%|6         | 6/100 [00:01<00:21,  4.38it/s]Best trial: 1. Best value: 0.818802:   6%|6         | 6/100 [00:01<00:21,  4.38it/s]Best trial: 1. Best value: 0.818802:   7%|7         | 7/100 [00:01<00:20,  4.49it/s]                                                                                    [32m[I 2026-07-13 13:25:09,981][0m Trial 7 finished with value: 0.8145966709346991 and parameters: {'criterion': 'entropy', 'max_depth': 9, 'min_samples_split': 15, 'min_samples_leaf': 6, 'max_leaf_nodes': 40, 'ccp_alpha': 0.001}. Best is trial 1 with value: 0.8188023244361272.[0m
Best trial: 1. Best value: 0.818802:   7%|7         | 7/100 [00:01<00:20,  4.49it/s]Best trial: 1. Best value: 0.818802:   7%|7         | 7/100 [00:01<00:20,  4.49it/s]Best trial: 1. Best value: 0.818802:   8%|8         | 8/100 [00:01<00:20,  4.47it/s]                                                                                    [32m[I 2026-07-13 13:25:10,200][0m Trial 8 finished with value: 0.8089333202009259 and parameters: {'criterion': 'entropy', 'max_depth': 6, 'min_samples_split': 12, 'min_samples_leaf': 8, 'max_leaf_nodes': 40, 'ccp_alpha': 0.01}. Best is trial 1 with value: 0.8188023244361272.[0m
Best trial: 1. Best value: 0.818802:   8%|8         | 8/100 [00:01<00:20,  4.47it/s]Best trial: 1. Best value: 0.818802:   8%|8         | 8/100 [00:02<00:20,  4.47it/s]Best trial: 1. Best value: 0.818802:   9%|9         | 9/100 [00:02<00:20,  4.49it/s]                                                                                    [32m[I 2026-07-13 13:25:10,431][0m Trial 9 finished with value: 0.8089333202009259 and parameters: {'criterion': 'log_loss', 'max_depth': 9, 'min_samples_split': 10, 'min_samples_leaf': 7, 'max_leaf_nodes': 10, 'ccp_alpha': 0.01}. Best is trial 1 with value: 0.8188023244361272.[0m
Best trial: 1. Best value: 0.818802:   9%|9         | 9/100 [00:02<00:20,  4.49it/s]Best trial: 1. Best value: 0.818802:   9%|9         | 9/100 [00:02<00:20,  4.49it/s]Best trial: 1. Best value: 0.818802:  10%|#         | 10/100 [00:02<00:20,  4.47it/s]                                                                                     [32m[I 2026-07-13 13:25:10,674][0m Trial 10 finished with value: 0.8229882793263075 and parameters: {'criterion': 'log_loss', 'max_depth': 12, 'min_samples_split': 2, 'min_samples_leaf': 2, 'max_leaf_nodes': 18, 'ccp_alpha': 0.003}. Best is trial 10 with value: 0.8229882793263075.[0m
Best trial: 1. Best value: 0.818802:  10%|#         | 10/100 [00:02<00:20,  4.47it/s]Best trial: 10. Best value: 0.822988:  10%|#         | 10/100 [00:02<00:20,  4.47it/s]Best trial: 10. Best value: 0.822988:  11%|#1        | 11/100 [00:02<00:20,  4.43it/s]                                                                                      [32m[I 2026-07-13 13:25:10,906][0m Trial 11 finished with value: 0.8201713779178569 and parameters: {'criterion': 'log_loss', 'max_depth': 12, 'min_samples_split': 2, 'min_samples_leaf': 1, 'max_leaf_nodes': 18, 'ccp_alpha': 0.003}. Best is trial 10 with value: 0.8229882793263075.[0m
Best trial: 10. Best value: 0.822988:  11%|#1        | 11/100 [00:02<00:20,  4.43it/s]Best trial: 10. Best value: 0.822988:  11%|#1        | 11/100 [00:02<00:20,  4.43it/s]Best trial: 10. Best value: 0.822988:  12%|#2        | 12/100 [00:02<00:20,  4.39it/s]                                                                                      [32m[I 2026-07-13 13:25:11,137][0m Trial 12 finished with value: 0.8201713779178569 and parameters: {'criterion': 'log_loss', 'max_depth': 12, 'min_samples_split': 2, 'min_samples_leaf': 1, 'max_leaf_nodes': 18, 'ccp_alpha': 0.003}. Best is trial 10 with value: 0.8229882793263075.[0m
Best trial: 10. Best value: 0.822988:  12%|#2        | 12/100 [00:02<00:20,  4.39it/s]Best trial: 10. Best value: 0.822988:  12%|#2        | 12/100 [00:02<00:20,  4.39it/s]Best trial: 10. Best value: 0.822988:  13%|#3        | 13/100 [00:02<00:19,  4.36it/s]                                                                                      [32m[I 2026-07-13 13:25:11,370][0m Trial 13 finished with value: 0.8257854821235103 and parameters: {'criterion': 'log_loss', 'max_depth': 12, 'min_samples_split': 2, 'min_samples_leaf': 3, 'max_leaf_nodes': 18, 'ccp_alpha': 0.003}. Best is trial 13 with value: 0.8257854821235103.[0m
Best trial: 10. Best value: 0.822988:  13%|#3        | 13/100 [00:03<00:19,  4.36it/s]Best trial: 13. Best value: 0.825785:  13%|#3        | 13/100 [00:03<00:19,  4.36it/s]Best trial: 13. Best value: 0.825785:  14%|#4        | 14/100 [00:03<00:19,  4.31it/s]                                                                                      [32m[I 2026-07-13 13:25:11,612][0m Trial 14 finished with value: 0.806136117403723 and parameters: {'criterion': 'log_loss', 'max_depth': 11, 'min_samples_split': 5, 'min_samples_leaf': 3, 'max_leaf_nodes': None, 'ccp_alpha': 0.0}. Best is trial 13 with value: 0.8257854821235103.[0m
Best trial: 13. Best value: 0.825785:  14%|#4        | 14/100 [00:03<00:19,  4.31it/s]Best trial: 13. Best value: 0.825785:  14%|#4        | 14/100 [00:03<00:19,  4.31it/s]Best trial: 13. Best value: 0.825785:  15%|#5        | 15/100 [00:03<00:19,  4.30it/s]                                                                                      [32m[I 2026-07-13 13:25:11,841][0m Trial 15 finished with value: 0.8103516202107752 and parameters: {'criterion': 'entropy', 'max_depth': 10, 'min_samples_split': 5, 'min_samples_leaf': 4, 'max_leaf_nodes': 25, 'ccp_alpha': 0.005}. Best is trial 13 with value: 0.8257854821235103.[0m
Best trial: 13. Best value: 0.825785:  15%|#5        | 15/100 [00:03<00:19,  4.30it/s]Best trial: 13. Best value: 0.825785:  15%|#5        | 15/100 [00:03<00:19,  4.30it/s]Best trial: 13. Best value: 0.825785:  16%|#6        | 16/100 [00:03<00:19,  4.32it/s]                                                                                      [32m[I 2026-07-13 13:25:12,054][0m Trial 16 finished with value: 0.8257854821235103 and parameters: {'criterion': 'log_loss', 'max_depth': 11, 'min_samples_split': 2, 'min_samples_leaf': 3, 'max_leaf_nodes': 18, 'ccp_alpha': 0.004}. Best is trial 13 with value: 0.8257854821235103.[0m
Best trial: 13. Best value: 0.825785:  16%|#6        | 16/100 [00:03<00:19,  4.32it/s]Best trial: 13. Best value: 0.825785:  16%|#6        | 16/100 [00:03<00:19,  4.32it/s]Best trial: 13. Best value: 0.825785:  17%|#7        | 17/100 [00:03<00:19,  4.36it/s]                                                                                      [32m[I 2026-07-13 13:25:12,305][0m Trial 17 finished with value: 0.7906628582684921 and parameters: {'criterion': 'log_loss', 'max_depth': 10, 'min_samples_split': 7, 'min_samples_leaf': 11, 'max_leaf_nodes': 30, 'ccp_alpha': 0.004}. Best is trial 13 with value: 0.8257854821235103.[0m
Best trial: 13. Best value: 0.825785:  17%|#7        | 17/100 [00:04<00:19,  4.36it/s]Best trial: 13. Best value: 0.825785:  17%|#7        | 17/100 [00:04<00:19,  4.36it/s]Best trial: 13. Best value: 0.825785:  18%|#8        | 18/100 [00:04<00:19,  4.26it/s]                                                                                      [32m[I 2026-07-13 13:25:12,547][0m Trial 18 finished with value: 0.8089037722840541 and parameters: {'criterion': 'gini', 'max_depth': 11, 'min_samples_split': 14, 'min_samples_leaf': 5, 'max_leaf_nodes': 18, 'ccp_alpha': 0.004}. Best is trial 13 with value: 0.8257854821235103.[0m
Best trial: 13. Best value: 0.825785:  18%|#8        | 18/100 [00:04<00:19,  4.26it/s]Best trial: 13. Best value: 0.825785:  18%|#8        | 18/100 [00:04<00:19,  4.26it/s]Best trial: 13. Best value: 0.825785:  19%|#9        | 19/100 [00:04<00:19,  4.22it/s]                                                                                      [32m[I 2026-07-13 13:25:12,785][0m Trial 19 finished with value: 0.7864572047670639 and parameters: {'criterion': 'entropy', 'max_depth': 11, 'min_samples_split': 5, 'min_samples_leaf': 12, 'max_leaf_nodes': 35, 'ccp_alpha': 0.004}. Best is trial 13 with value: 0.8257854821235103.[0m
Best trial: 13. Best value: 0.825785:  19%|#9        | 19/100 [00:04<00:19,  4.22it/s]Best trial: 13. Best value: 0.825785:  19%|#9        | 19/100 [00:04<00:19,  4.22it/s]Best trial: 13. Best value: 0.825785:  20%|##        | 20/100 [00:04<00:18,  4.22it/s]                                                                                      [32m[I 2026-07-13 13:25:13,021][0m Trial 20 finished with value: 0.8089924160346695 and parameters: {'criterion': 'log_loss', 'max_depth': 10, 'min_samples_split': 29, 'min_samples_leaf': 3, 'max_leaf_nodes': 22, 'ccp_alpha': 0.0}. Best is trial 13 with value: 0.8257854821235103.[0m
Best trial: 13. Best value: 0.825785:  20%|##        | 20/100 [00:04<00:18,  4.22it/s]Best trial: 13. Best value: 0.825785:  20%|##        | 20/100 [00:04<00:18,  4.22it/s]Best trial: 13. Best value: 0.825785:  21%|##1       | 21/100 [00:04<00:18,  4.25it/s]                                                                                      [32m[I 2026-07-13 13:25:13,254][0m Trial 21 finished with value: 0.8229882793263075 and parameters: {'criterion': 'log_loss', 'max_depth': 12, 'min_samples_split': 2, 'min_samples_leaf': 2, 'max_leaf_nodes': 18, 'ccp_alpha': 0.003}. Best is trial 13 with value: 0.8257854821235103.[0m
Best trial: 13. Best value: 0.825785:  21%|##1       | 21/100 [00:05<00:18,  4.25it/s]Best trial: 13. Best value: 0.825785:  21%|##1       | 21/100 [00:05<00:18,  4.25it/s]Best trial: 13. Best value: 0.825785:  22%|##2       | 22/100 [00:05<00:18,  4.25it/s]                                                                                      [32m[I 2026-07-13 13:25:13,522][0m Trial 22 finished with value: 0.8257854821235103 and parameters: {'criterion': 'log_loss', 'max_depth': 12, 'min_samples_split': 4, 'min_samples_leaf': 3, 'max_leaf_nodes': 18, 'ccp_alpha': 0.003}. Best is trial 13 with value: 0.8257854821235103.[0m
Best trial: 13. Best value: 0.825785:  22%|##2       | 22/100 [00:05<00:18,  4.25it/s]Best trial: 13. Best value: 0.825785:  22%|##2       | 22/100 [00:05<00:18,  4.25it/s]Best trial: 13. Best value: 0.825785:  23%|##3       | 23/100 [00:05<00:18,  4.08it/s]                                                                                      [32m[I 2026-07-13 13:25:13,758][0m Trial 23 finished with value: 0.8103910174332711 and parameters: {'criterion': 'log_loss', 'max_depth': 11, 'min_samples_split': 5, 'min_samples_leaf': 6, 'max_leaf_nodes': 18, 'ccp_alpha': 0.0005}. Best is trial 13 with value: 0.8257854821235103.[0m
Best trial: 13. Best value: 0.825785:  23%|##3       | 23/100 [00:05<00:18,  4.08it/s]Best trial: 13. Best value: 0.825785:  23%|##3       | 23/100 [00:05<00:18,  4.08it/s]Best trial: 13. Best value: 0.825785:  24%|##4       | 24/100 [00:05<00:18,  4.12it/s]                                                                                      [32m[I 2026-07-13 13:25:13,997][0m Trial 24 finished with value: 0.8272037821333595 and parameters: {'criterion': 'log_loss', 'max_depth': 10, 'min_samples_split': 8, 'min_samples_leaf': 4, 'max_leaf_nodes': 18, 'ccp_alpha': 0.002}. Best is trial 24 with value: 0.8272037821333595.[0m
Best trial: 13. Best value: 0.825785:  24%|##4       | 24/100 [00:05<00:18,  4.12it/s]Best trial: 24. Best value: 0.827204:  24%|##4       | 24/100 [00:05<00:18,  4.12it/s]Best trial: 24. Best value: 0.827204:  25%|##5       | 25/100 [00:05<00:18,  4.13it/s]                                                                                      [32m[I 2026-07-13 13:25:14,243][0m Trial 25 finished with value: 0.8117699202206244 and parameters: {'criterion': 'log_loss', 'max_depth': 8, 'min_samples_split': 8, 'min_samples_leaf': 5, 'max_leaf_nodes': 22, 'ccp_alpha': 0.002}. Best is trial 24 with value: 0.8272037821333595.[0m
Best trial: 24. Best value: 0.827204:  25%|##5       | 25/100 [00:06<00:18,  4.13it/s]Best trial: 24. Best value: 0.827204:  25%|##5       | 25/100 [00:06<00:18,  4.13it/s]Best trial: 24. Best value: 0.827204:  26%|##6       | 26/100 [00:06<00:17,  4.14it/s]                                                                                      [32m[I 2026-07-13 13:25:14,477][0m Trial 26 finished with value: 0.8033093666896484 and parameters: {'criterion': 'log_loss', 'max_depth': 10, 'min_samples_split': 11, 'min_samples_leaf': 7, 'max_leaf_nodes': 35, 'ccp_alpha': 0.002}. Best is trial 24 with value: 0.8272037821333595.[0m
Best trial: 24. Best value: 0.827204:  26%|##6       | 26/100 [00:06<00:17,  4.14it/s]Best trial: 24. Best value: 0.827204:  26%|##6       | 26/100 [00:06<00:17,  4.14it/s]Best trial: 24. Best value: 0.827204:  27%|##7       | 27/100 [00:06<00:17,  4.17it/s]                                                                                      [32m[I 2026-07-13 13:25:14,711][0m Trial 27 finished with value: 0.8005515611149413 and parameters: {'criterion': 'log_loss', 'max_depth': 11, 'min_samples_split': 13, 'min_samples_leaf': 4, 'max_leaf_nodes': None, 'ccp_alpha': 0.0015}. Best is trial 24 with value: 0.8272037821333595.[0m
Best trial: 24. Best value: 0.827204:  27%|##7       | 27/100 [00:06<00:17,  4.17it/s]Best trial: 24. Best value: 0.827204:  27%|##7       | 27/100 [00:06<00:17,  4.17it/s]Best trial: 24. Best value: 0.827204:  28%|##8       | 28/100 [00:06<00:17,  4.17it/s]                                                                                      [32m[I 2026-07-13 13:25:14,955][0m Trial 28 finished with value: 0.8103713188220232 and parameters: {'criterion': 'entropy', 'max_depth': 8, 'min_samples_split': 16, 'min_samples_leaf': 1, 'max_leaf_nodes': 25, 'ccp_alpha': 0.005}. Best is trial 24 with value: 0.8272037821333595.[0m
Best trial: 24. Best value: 0.827204:  28%|##8       | 28/100 [00:06<00:17,  4.17it/s]Best trial: 24. Best value: 0.827204:  28%|##8       | 28/100 [00:06<00:17,  4.17it/s]Best trial: 24. Best value: 0.827204:  29%|##9       | 29/100 [00:06<00:17,  4.17it/s]                                                                                      [32m[I 2026-07-13 13:25:15,186][0m Trial 29 finished with value: 0.8004826159755737 and parameters: {'criterion': 'gini', 'max_depth': 10, 'min_samples_split': 8, 'min_samples_leaf': 6, 'max_leaf_nodes': 20, 'ccp_alpha': 0.0015}. Best is trial 24 with value: 0.8272037821333595.[0m
Best trial: 24. Best value: 0.827204:  29%|##9       | 29/100 [00:06<00:17,  4.17it/s]Best trial: 24. Best value: 0.827204:  29%|##9       | 29/100 [00:06<00:17,  4.17it/s]Best trial: 24. Best value: 0.827204:  30%|###       | 30/100 [00:06<00:16,  4.24it/s]                                                                                      [32m[I 2026-07-13 13:25:15,412][0m Trial 30 finished with value: 0.8089530188121736 and parameters: {'criterion': 'log_loss', 'max_depth': 9, 'min_samples_split': 9, 'min_samples_leaf': 3, 'max_leaf_nodes': 30, 'ccp_alpha': 0.002}. Best is trial 24 with value: 0.8272037821333595.[0m
Best trial: 24. Best value: 0.827204:  30%|###       | 30/100 [00:07<00:16,  4.24it/s]Best trial: 24. Best value: 0.827204:  30%|###       | 30/100 [00:07<00:16,  4.24it/s]Best trial: 24. Best value: 0.827204:  31%|###1      | 31/100 [00:07<00:16,  4.26it/s]                                                                                      [32m[I 2026-07-13 13:25:15,652][0m Trial 31 finished with value: 0.8257854821235103 and parameters: {'criterion': 'log_loss', 'max_depth': 12, 'min_samples_split': 4, 'min_samples_leaf': 3, 'max_leaf_nodes': 18, 'ccp_alpha': 0.004}. Best is trial 24 with value: 0.8272037821333595.[0m
Best trial: 24. Best value: 0.827204:  31%|###1      | 31/100 [00:07<00:16,  4.26it/s]Best trial: 24. Best value: 0.827204:  31%|###1      | 31/100 [00:07<00:16,  4.26it/s]Best trial: 24. Best value: 0.827204:  32%|###2      | 32/100 [00:07<00:15,  4.26it/s]                                                                                      [32m[I 2026-07-13 13:25:15,886][0m Trial 32 finished with value: 0.8272037821333595 and parameters: {'criterion': 'log_loss', 'max_depth': 11, 'min_samples_split': 4, 'min_samples_leaf': 4, 'max_leaf_nodes': 18, 'ccp_alpha': 0.003}. Best is trial 24 with value: 0.8272037821333595.[0m
Best trial: 24. Best value: 0.827204:  32%|###2      | 32/100 [00:07<00:15,  4.26it/s]Best trial: 24. Best value: 0.827204:  32%|###2      | 32/100 [00:07<00:15,  4.26it/s]Best trial: 24. Best value: 0.827204:  33%|###3      | 33/100 [00:07<00:15,  4.25it/s]                                                                                      [32m[I 2026-07-13 13:25:16,103][0m Trial 33 finished with value: 0.8272037821333595 and parameters: {'criterion': 'log_loss', 'max_depth': 11, 'min_samples_split': 6, 'min_samples_leaf': 4, 'max_leaf_nodes': 18, 'ccp_alpha': 0.003}. Best is trial 24 with value: 0.8272037821333595.[0m
