Best trial: 24. Best value: 0.827204:  33%|###3      | 33/100 [00:07<00:15,  4.25it/s]Best trial: 24. Best value: 0.827204:  33%|###3      | 33/100 [00:07<00:15,  4.25it/s]Best trial: 24. Best value: 0.827204:  34%|###4      | 34/100 [00:07<00:15,  4.28it/s]                                                                                      [32m[I 2026-07-13 13:25:16,379][0m Trial 34 finished with value: 0.817374175120654 and parameters: {'criterion': 'log_loss', 'max_depth': 11, 'min_samples_split': 7, 'min_samples_leaf': 5, 'max_leaf_nodes': 18, 'ccp_alpha': 0.003}. Best is trial 24 with value: 0.8272037821333595.[0m
Best trial: 24. Best value: 0.827204:  34%|###4      | 34/100 [00:08<00:15,  4.28it/s]Best trial: 24. Best value: 0.827204:  34%|###4      | 34/100 [00:08<00:15,  4.28it/s]Best trial: 24. Best value: 0.827204:  35%|###5      | 35/100 [00:08<00:16,  4.03it/s]                                                                                      [32m[I 2026-07-13 13:25:16,684][0m Trial 35 finished with value: 0.8272037821333595 and parameters: {'criterion': 'log_loss', 'max_depth': 10, 'min_samples_split': 10, 'min_samples_leaf': 4, 'max_leaf_nodes': 18, 'ccp_alpha': 0.003}. Best is trial 24 with value: 0.8272037821333595.[0m
Best trial: 24. Best value: 0.827204:  35%|###5      | 35/100 [00:08<00:16,  4.03it/s]Best trial: 24. Best value: 0.827204:  35%|###5      | 35/100 [00:08<00:16,  4.03it/s]Best trial: 24. Best value: 0.827204:  36%|###6      | 36/100 [00:08<00:16,  3.80it/s]                                                                                      [32m[I 2026-07-13 13:25:16,995][0m Trial 36 finished with value: 0.8272037821333595 and parameters: {'criterion': 'log_loss', 'max_depth': 8, 'min_samples_split': 9, 'min_samples_leaf': 4, 'max_leaf_nodes': 18, 'ccp_alpha': 0.003}. Best is trial 24 with value: 0.8272037821333595.[0m
Best trial: 24. Best value: 0.827204:  36%|###6      | 36/100 [00:08<00:16,  3.80it/s]Best trial: 24. Best value: 0.827204:  36%|###6      | 36/100 [00:08<00:16,  3.80it/s]Best trial: 24. Best value: 0.827204:  37%|###7      | 37/100 [00:08<00:17,  3.60it/s]                                                                                      [32m[I 2026-07-13 13:25:17,256][0m Trial 37 finished with value: 0.7906333103516202 and parameters: {'criterion': 'gini', 'max_depth': 10, 'min_samples_split': 17, 'min_samples_leaf': 14, 'max_leaf_nodes': 20, 'ccp_alpha': 0.0005}. Best is trial 24 with value: 0.8272037821333595.[0m
Best trial: 24. Best value: 0.827204:  37%|###7      | 37/100 [00:09<00:17,  3.60it/s]Best trial: 24. Best value: 0.827204:  37%|###7      | 37/100 [00:09<00:17,  3.60it/s]Best trial: 24. Best value: 0.827204:  38%|###8      | 38/100 [00:09<00:16,  3.69it/s]                                                                                      [32m[I 2026-07-13 13:25:17,506][0m Trial 38 finished with value: 0.8131882202304738 and parameters: {'criterion': 'log_loss', 'max_depth': 3, 'min_samples_split': 11, 'min_samples_leaf': 7, 'max_leaf_nodes': 10, 'ccp_alpha': 0.003}. Best is trial 24 with value: 0.8272037821333595.[0m
Best trial: 24. Best value: 0.827204:  38%|###8      | 38/100 [00:09<00:16,  3.69it/s]Best trial: 24. Best value: 0.827204:  38%|###8      | 38/100 [00:09<00:16,  3.69it/s]Best trial: 24. Best value: 0.827204:  39%|###9      | 39/100 [00:09<00:16,  3.80it/s]                                                                                      [32m[I 2026-07-13 13:25:17,755][0m Trial 39 finished with value: 0.8230079779375554 and parameters: {'criterion': 'log_loss', 'max_depth': 9, 'min_samples_split': 6, 'min_samples_leaf': 4, 'max_leaf_nodes': 15, 'ccp_alpha': 0.001}. Best is trial 24 with value: 0.8272037821333595.[0m
Best trial: 24. Best value: 0.827204:  39%|###9      | 39/100 [00:09<00:16,  3.80it/s]Best trial: 24. Best value: 0.827204:  39%|###9      | 39/100 [00:09<00:16,  3.80it/s]Best trial: 24. Best value: 0.827204:  40%|####      | 40/100 [00:09<00:15,  3.86it/s]                                                                                      [32m[I 2026-07-13 13:25:18,004][0m Trial 40 finished with value: 0.7836107554417413 and parameters: {'criterion': 'gini', 'max_depth': 7, 'min_samples_split': 23, 'min_samples_leaf': 8, 'max_leaf_nodes': 40, 'ccp_alpha': 0.002}. Best is trial 24 with value: 0.8272037821333595.[0m
Best trial: 24. Best value: 0.827204:  40%|####      | 40/100 [00:09<00:15,  3.86it/s]Best trial: 24. Best value: 0.827204:  40%|####      | 40/100 [00:09<00:15,  3.86it/s]Best trial: 24. Best value: 0.827204:  41%|####1     | 41/100 [00:09<00:15,  3.91it/s]                                                                                      [32m[I 2026-07-13 13:25:18,250][0m Trial 41 finished with value: 0.8272037821333595 and parameters: {'criterion': 'log_loss', 'max_depth': 8, 'min_samples_split': 9, 'min_samples_leaf': 4, 'max_leaf_nodes': 18, 'ccp_alpha': 0.003}. Best is trial 24 with value: 0.8272037821333595.[0m
Best trial: 24. Best value: 0.827204:  41%|####1     | 41/100 [00:10<00:15,  3.91it/s]Best trial: 24. Best value: 0.827204:  41%|####1     | 41/100 [00:10<00:15,  3.91it/s]Best trial: 24. Best value: 0.827204:  42%|####2     | 42/100 [00:10<00:14,  3.95it/s]                                                                                      [32m[I 2026-07-13 13:25:18,492][0m Trial 42 finished with value: 0.8103417709051512 and parameters: {'criterion': 'log_loss', 'max_depth': 4, 'min_samples_split': 10, 'min_samples_leaf': 5, 'max_leaf_nodes': 18, 'ccp_alpha': 0.003}. Best is trial 24 with value: 0.8272037821333595.[0m
Best trial: 24. Best value: 0.827204:  42%|####2     | 42/100 [00:10<00:14,  3.95it/s]Best trial: 24. Best value: 0.827204:  42%|####2     | 42/100 [00:10<00:14,  3.95it/s]Best trial: 24. Best value: 0.827204:  43%|####3     | 43/100 [00:10<00:14,  3.99it/s]                                                                                      [32m[I 2026-07-13 13:25:18,741][0m Trial 43 finished with value: 0.8103910174332711 and parameters: {'criterion': 'log_loss', 'max_depth': 9, 'min_samples_split': 13, 'min_samples_leaf': 6, 'max_leaf_nodes': 18, 'ccp_alpha': 0.003}. Best is trial 24 with value: 0.8272037821333595.[0m
Best trial: 24. Best value: 0.827204:  43%|####3     | 43/100 [00:10<00:14,  3.99it/s]Best trial: 24. Best value: 0.827204:  43%|####3     | 43/100 [00:10<00:14,  3.99it/s]Best trial: 24. Best value: 0.827204:  44%|####4     | 44/100 [00:10<00:14,  3.97it/s]                                                                                      [32m[I 2026-07-13 13:25:18,991][0m Trial 44 finished with value: 0.8173643258150299 and parameters: {'criterion': 'log_loss', 'max_depth': 6, 'min_samples_split': 9, 'min_samples_leaf': 4, 'max_leaf_nodes': 18, 'ccp_alpha': 0.003}. Best is trial 24 with value: 0.8272037821333595.[0m
Best trial: 24. Best value: 0.827204:  44%|####4     | 44/100 [00:10<00:14,  3.97it/s]Best trial: 24. Best value: 0.827204:  44%|####4     | 44/100 [00:10<00:14,  3.97it/s]Best trial: 24. Best value: 0.827204:  45%|####5     | 45/100 [00:10<00:13,  4.00it/s]                                                                                      [32m[I 2026-07-13 13:25:19,235][0m Trial 45 finished with value: 0.8215798286220821 and parameters: {'criterion': 'log_loss', 'max_depth': 7, 'min_samples_split': 11, 'min_samples_leaf': 2, 'max_leaf_nodes': 18, 'ccp_alpha': 0.003}. Best is trial 24 with value: 0.8272037821333595.[0m
Best trial: 24. Best value: 0.827204:  45%|####5     | 45/100 [00:10<00:13,  4.00it/s]Best trial: 24. Best value: 0.827204:  45%|####5     | 45/100 [00:11<00:13,  4.00it/s]Best trial: 24. Best value: 0.827204:  46%|####6     | 46/100 [00:11<00:13,  4.05it/s]                                                                                      [32m[I 2026-07-13 13:25:19,478][0m Trial 46 finished with value: 0.8173840244262781 and parameters: {'criterion': 'entropy', 'max_depth': 8, 'min_samples_split': 7, 'min_samples_leaf': 5, 'max_leaf_nodes': 10, 'ccp_alpha': 0.01}. Best is trial 24 with value: 0.8272037821333595.[0m
Best trial: 24. Best value: 0.827204:  46%|####6     | 46/100 [00:11<00:13,  4.05it/s]Best trial: 24. Best value: 0.827204:  46%|####6     | 46/100 [00:11<00:13,  4.05it/s]Best trial: 24. Best value: 0.827204:  47%|####6     | 47/100 [00:11<00:13,  4.07it/s]                                                                                      [32m[I 2026-07-13 13:25:19,722][0m Trial 47 finished with value: 0.8187924751305033 and parameters: {'criterion': 'log_loss', 'max_depth': 9, 'min_samples_split': 4, 'min_samples_leaf': 2, 'max_leaf_nodes': 25, 'ccp_alpha': 0.002}. Best is trial 24 with value: 0.8272037821333595.[0m
Best trial: 24. Best value: 0.827204:  47%|####6     | 47/100 [00:11<00:13,  4.07it/s]Best trial: 24. Best value: 0.827204:  47%|####6     | 47/100 [00:11<00:13,  4.07it/s]Best trial: 24. Best value: 0.827204:  48%|####8     | 48/100 [00:11<00:12,  4.07it/s]                                                                                      [32m[I 2026-07-13 13:25:19,965][0m Trial 48 finished with value: 0.8159952723333005 and parameters: {'criterion': 'log_loss', 'max_depth': 10, 'min_samples_split': 12, 'min_samples_leaf': 6, 'max_leaf_nodes': None, 'ccp_alpha': 0.001}. Best is trial 24 with value: 0.8272037821333595.[0m
Best trial: 24. Best value: 0.827204:  48%|####8     | 48/100 [00:11<00:12,  4.07it/s]Best trial: 24. Best value: 0.827204:  48%|####8     | 48/100 [00:11<00:12,  4.07it/s]Best trial: 24. Best value: 0.827204:  49%|####9     | 49/100 [00:11<00:12,  4.08it/s]                                                                                      [32m[I 2026-07-13 13:25:20,188][0m Trial 49 finished with value: 0.8272037821333595 and parameters: {'criterion': 'log_loss', 'max_depth': 11, 'min_samples_split': 8, 'min_samples_leaf': 4, 'max_leaf_nodes': 18, 'ccp_alpha': 0.0}. Best is trial 24 with value: 0.8272037821333595.[0m
Best trial: 24. Best value: 0.827204:  49%|####9     | 49/100 [00:11<00:12,  4.08it/s]Best trial: 24. Best value: 0.827204:  49%|####9     | 49/100 [00:12<00:12,  4.08it/s]Best trial: 24. Best value: 0.827204:  50%|#####     | 50/100 [00:12<00:12,  4.01it/s]                                                                                      [32m[I 2026-07-13 13:25:20,467][0m Trial 50 finished with value: 0.8103614695163991 and parameters: {'criterion': 'log_loss', 'max_depth': 5, 'min_samples_split': 10, 'min_samples_leaf': 1, 'max_leaf_nodes': 15, 'ccp_alpha': 0.005}. Best is trial 24 with value: 0.8272037821333595.[0m
Best trial: 24. Best value: 0.827204:  50%|#####     | 50/100 [00:12<00:12,  4.01it/s]Best trial: 24. Best value: 0.827204:  50%|#####     | 50/100 [00:12<00:12,  4.01it/s]Best trial: 24. Best value: 0.827204:  51%|#####1    | 51/100 [00:12<00:12,  4.05it/s]                                                                                      [32m[I 2026-07-13 13:25:20,712][0m Trial 51 finished with value: 0.8272037821333595 and parameters: {'criterion': 'log_loss', 'max_depth': 8, 'min_samples_split': 9, 'min_samples_leaf': 4, 'max_leaf_nodes': 18, 'ccp_alpha': 0.003}. Best is trial 24 with value: 0.8272037821333595.[0m
Best trial: 24. Best value: 0.827204:  51%|#####1    | 51/100 [00:12<00:12,  4.05it/s]Best trial: 24. Best value: 0.827204:  51%|#####1    | 51/100 [00:12<00:12,  4.05it/s]Best trial: 24. Best value: 0.827204:  52%|#####2    | 52/100 [00:12<00:11,  4.05it/s]                                                                                      [32m[I 2026-07-13 13:25:20,955][0m Trial 52 finished with value: 0.8159755737220526 and parameters: {'criterion': 'log_loss', 'max_depth': 6, 'min_samples_split': 6, 'min_samples_leaf': 5, 'max_leaf_nodes': 18, 'ccp_alpha': 0.003}. Best is trial 24 with value: 0.8272037821333595.[0m
Best trial: 24. Best value: 0.827204:  52%|#####2    | 52/100 [00:12<00:11,  4.05it/s]Best trial: 24. Best value: 0.827204:  52%|#####2    | 52/100 [00:12<00:11,  4.05it/s]Best trial: 24. Best value: 0.827204:  53%|#####3    | 53/100 [00:12<00:11,  4.05it/s]                                                                                      [32m[I 2026-07-13 13:25:21,202][0m Trial 53 finished with value: 0.8229882793263075 and parameters: {'criterion': 'log_loss', 'max_depth': 8, 'min_samples_split': 9, 'min_samples_leaf': 2, 'max_leaf_nodes': 18, 'ccp_alpha': 0.003}. Best is trial 24 with value: 0.8272037821333595.[0m
Best trial: 24. Best value: 0.827204:  53%|#####3    | 53/100 [00:12<00:11,  4.05it/s]Best trial: 24. Best value: 0.827204:  53%|#####3    | 53/100 [00:13<00:11,  4.05it/s]Best trial: 24. Best value: 0.827204:  54%|#####4    | 54/100 [00:13<00:11,  4.07it/s]                                                                                      [32m[I 2026-07-13 13:25:21,456][0m Trial 54 finished with value: 0.8061656653205949 and parameters: {'criterion': 'log_loss', 'max_depth': 7, 'min_samples_split': 6, 'min_samples_leaf': 4, 'max_leaf_nodes': 40, 'ccp_alpha': 0.003}. Best is trial 24 with value: 0.8272037821333595.[0m
Best trial: 24. Best value: 0.827204:  54%|#####4    | 54/100 [00:13<00:11,  4.07it/s]Best trial: 24. Best value: 0.827204:  54%|#####4    | 54/100 [00:13<00:11,  4.07it/s]Best trial: 24. Best value: 0.827204:  55%|#####5    | 55/100 [00:13<00:11,  4.03it/s]                                                                                      [32m[I 2026-07-13 13:25:21,694][0m Trial 55 finished with value: 0.8257854821235103 and parameters: {'criterion': 'entropy', 'max_depth': 10, 'min_samples_split': 3, 'min_samples_leaf': 3, 'max_leaf_nodes': 18, 'ccp_alpha': 0.003}. Best is trial 24 with value: 0.8272037821333595.[0m
Best trial: 24. Best value: 0.827204:  55%|#####5    | 55/100 [00:13<00:11,  4.03it/s]Best trial: 24. Best value: 0.827204:  55%|#####5    | 55/100 [00:13<00:11,  4.03it/s]Best trial: 24. Best value: 0.827204:  56%|#####6    | 56/100 [00:13<00:10,  4.09it/s]                                                                                      [32m[I 2026-07-13 13:25:21,934][0m Trial 56 finished with value: 0.8061558160149709 and parameters: {'criterion': 'log_loss', 'max_depth': 9, 'min_samples_split': 8, 'min_samples_leaf': 5, 'max_leaf_nodes': 30, 'ccp_alpha': 0.003}. Best is trial 24 with value: 0.8272037821333595.[0m
Best trial: 24. Best value: 0.827204:  56%|#####6    | 56/100 [00:13<00:10,  4.09it/s]Best trial: 24. Best value: 0.827204:  56%|#####6    | 56/100 [00:13<00:10,  4.09it/s]Best trial: 24. Best value: 0.827204:  57%|#####6    | 57/100 [00:13<00:10,  4.09it/s]                                                                                      [32m[I 2026-07-13 13:25:22,182][0m Trial 57 finished with value: 0.7906333103516203 and parameters: {'criterion': 'gini', 'max_depth': 11, 'min_samples_split': 12, 'min_samples_leaf': 7, 'max_leaf_nodes': 35, 'ccp_alpha': 0.0005}. Best is trial 24 with value: 0.8272037821333595.[0m
Best trial: 24. Best value: 0.827204:  57%|#####6    | 57/100 [00:13<00:10,  4.09it/s]Best trial: 24. Best value: 0.827204:  57%|#####6    | 57/100 [00:14<00:10,  4.09it/s]Best trial: 24. Best value: 0.827204:  58%|#####8    | 58/100 [00:14<00:10,  4.08it/s]                                                                                      [32m[I 2026-07-13 13:25:22,423][0m Trial 58 finished with value: 0.8159755737220526 and parameters: {'criterion': 'log_loss', 'max_depth': 10, 'min_samples_split': 6, 'min_samples_leaf': 3, 'max_leaf_nodes': 22, 'ccp_alpha': 0.0015}. Best is trial 24 with value: 0.8272037821333595.[0m
Best trial: 24. Best value: 0.827204:  58%|#####8    | 58/100 [00:14<00:10,  4.08it/s]Best trial: 24. Best value: 0.827204:  58%|#####8    | 58/100 [00:14<00:10,  4.08it/s]Best trial: 24. Best value: 0.827204:  59%|#####8    | 59/100 [00:14<00:10,  4.08it/s]                                                                                      [32m[I 2026-07-13 13:25:22,668][0m Trial 59 finished with value: 0.8103417709051512 and parameters: {'criterion': 'log_loss', 'max_depth': 8, 'min_samples_split': 14, 'min_samples_leaf': 6, 'max_leaf_nodes': 18, 'ccp_alpha': 0.01}. Best is trial 24 with value: 0.8272037821333595.[0m
Best trial: 24. Best value: 0.827204:  59%|#####8    | 59/100 [00:14<00:10,  4.08it/s]Best trial: 24. Best value: 0.827204:  59%|#####8    | 59/100 [00:14<00:10,  4.08it/s]Best trial: 24. Best value: 0.827204:  60%|######    | 60/100 [00:14<00:09,  4.10it/s]                                                                                      [32m[I 2026-07-13 13:25:22,910][0m Trial 60 finished with value: 0.8272037821333595 and parameters: {'criterion': 'log_loss', 'max_depth': 9, 'min_samples_split': 4, 'min_samples_leaf': 4, 'max_leaf_nodes': 18, 'ccp_alpha': 0.003}. Best is trial 24 with value: 0.8272037821333595.[0m
Best trial: 24. Best value: 0.827204:  60%|######    | 60/100 [00:14<00:09,  4.10it/s]Best trial: 24. Best value: 0.827204:  60%|######    | 60/100 [00:14<00:09,  4.10it/s]Best trial: 24. Best value: 0.827204:  61%|######1   | 61/100 [00:14<00:09,  4.10it/s]                                                                                      [32m[I 2026-07-13 13:25:23,148][0m Trial 61 finished with value: 0.8272037821333595 and parameters: {'criterion': 'log_loss', 'max_depth': 11, 'min_samples_split': 8, 'min_samples_leaf': 4, 'max_leaf_nodes': 18, 'ccp_alpha': 0.0}. Best is trial 24 with value: 0.8272037821333595.[0m
Best trial: 24. Best value: 0.827204:  61%|######1   | 61/100 [00:14<00:09,  4.10it/s]Best trial: 24. Best value: 0.827204:  61%|######1   | 61/100 [00:14<00:09,  4.10it/s]Best trial: 24. Best value: 0.827204:  62%|######2   | 62/100 [00:14<00:09,  4.12it/s]                                                                                      [32m[I 2026-07-13 13:25:23,396][0m Trial 62 finished with value: 0.817374175120654 and parameters: {'criterion': 'log_loss', 'max_depth': 11, 'min_samples_split': 10, 'min_samples_leaf': 5, 'max_leaf_nodes': 18, 'ccp_alpha': 0.0}. Best is trial 24 with value: 0.8272037821333595.[0m
Best trial: 24. Best value: 0.827204:  62%|######2   | 62/100 [00:15<00:09,  4.12it/s]Best trial: 24. Best value: 0.827204:  62%|######2   | 62/100 [00:15<00:09,  4.12it/s]Best trial: 24. Best value: 0.827204:  63%|######3   | 63/100 [00:15<00:09,  4.08it/s]                                                                                      [32m[I 2026-07-13 13:25:23,649][0m Trial 63 finished with value: 0.8257854821235103 and parameters: {'criterion': 'log_loss', 'max_depth': 12, 'min_samples_split': 7, 'min_samples_leaf': 3, 'max_leaf_nodes': 18, 'ccp_alpha': 0.0}. Best is trial 24 with value: 0.8272037821333595.[0m
Best trial: 24. Best value: 0.827204:  63%|######3   | 63/100 [00:15<00:09,  4.08it/s]Best trial: 24. Best value: 0.827204:  63%|######3   | 63/100 [00:15<00:09,  4.08it/s]Best trial: 24. Best value: 0.827204:  64%|######4   | 64/100 [00:15<00:08,  4.09it/s]                                                                                      [32m[I 2026-07-13 13:25:23,891][0m Trial 64 finished with value: 0.8272037821333595 and parameters: {'criterion': 'log_loss', 'max_depth': 11, 'min_samples_split': 5, 'min_samples_leaf': 4, 'max_leaf_nodes': 18, 'ccp_alpha': 0.0}. Best is trial 24 with value: 0.8272037821333595.[0m
Best trial: 24. Best value: 0.827204:  64%|######4   | 64/100 [00:15<00:08,  4.09it/s]Best trial: 24. Best value: 0.827204:  64%|######4   | 64/100 [00:15<00:08,  4.09it/s]Best trial: 24. Best value: 0.827204:  65%|######5   | 65/100 [00:15<00:08,  4.12it/s]                                                                                      [32m[I 2026-07-13 13:25:24,125][0m Trial 65 finished with value: 0.8215896779277061 and parameters: {'criterion': 'log_loss', 'max_depth': 12, 'min_samples_split': 8, 'min_samples_leaf': 2, 'max_leaf_nodes': 20, 'ccp_alpha': 0.002}. Best is trial 24 with value: 0.8272037821333595.[0m
Best trial: 24. Best value: 0.827204:  65%|######5   | 65/100 [00:15<00:08,  4.12it/s]Best trial: 24. Best value: 0.827204:  65%|######5   | 65/100 [00:15<00:08,  4.12it/s]Best trial: 24. Best value: 0.827204:  66%|######6   | 66/100 [00:15<00:08,  4.15it/s]                                                                                      [32m[I 2026-07-13 13:25:24,336][0m Trial 66 finished with value: 0.817374175120654 and parameters: {'criterion': 'entropy', 'max_depth': 11, 'min_samples_split': 3, 'min_samples_leaf': 5, 'max_leaf_nodes': 18, 'ccp_alpha': 0.003}. Best is trial 24 with value: 0.8272037821333595.[0m
Best trial: 24. Best value: 0.827204:  66%|######6   | 66/100 [00:16<00:08,  4.15it/s]Best trial: 24. Best value: 0.827204:  66%|######6   | 66/100 [00:16<00:08,  4.15it/s]Best trial: 24. Best value: 0.827204:  67%|######7   | 67/100 [00:16<00:07,  4.26it/s]                                                                                      [32m[I 2026-07-13 13:25:24,579][0m Trial 67 finished with value: 0.8244065793361568 and parameters: {'criterion': 'log_loss', 'max_depth': 10, 'min_samples_split': 11, 'min_samples_leaf': 4, 'max_leaf_nodes': 18, 'ccp_alpha': 0.0}. Best is trial 24 with value: 0.8272037821333595.[0m
